{
  "schema_version": "1.0",
  "repo": "platform-backend",
  "service": "report-service",
  "git_sha": "efeaafe487dd8ce541edc25eb032f7519cb8002c",
  "git_short_sha": "efeaafe4",
  "image": {
    "registry": "ghcr.io",
    "path": "halildeu/platform-backend-report-service",
    "digest": "sha256:7f32f50243401187af4a59f2e54a6c6565a1e415afe2ea7a13eabf1992f78290",
    "tag": "sha-efeaafe",
    "push_run_id": null,
    "pushed_at": "2026-09-11T20:33:07Z"
  },
  "promotion": {
    "test": {
      "promoted_at": null,
      "promoted_by_pr": null,
      "argocd_revision": null,
      "smoke_evidence": {
        "d29_up": {
          "status": "GREEN",
          "checked_at": "2026-09-11T09:41:24Z",
          "details": "up=all 10 services Running+Ready | secured=all 10 services have correct KC issuer for test"
        },
        "d29_functional": {
          "status": "GREEN",
          "checked_at": "2026-09-11T09:41:24Z",
          "endpoints": [
            "/actuator/health",
            "/api/v1/users",
            "/api/v1/variants",
            "/api/v1/permissions",
            "/api/v1/schema/schemas",
            "/api/v1/reports",
            "/api/v1/impersonation/sessions",
            "/api/v1/companies",
            "/api/v1/notify/inbox/me",
            "/api/v1/admin/endpoint-devices"
          ],
          "details": "all 10 endpoints returned 200/401/403 (auth chain intact)"
        },
        "d29_zanzibar": {
          "status": "GREEN",
          "checked_at": "2026-09-11T09:41:24Z",
          "allow_deny_synthetic": "PASS",
          "details": "store_id_source=secret/permission-service-secrets:ERP_OPENFGA_STORE_ID; user:1204 admin=allow OK, user:9999999 admin=deny OK"
        }
      },
      "verified_at": "2026-09-11T09:41:24Z",
      "candidate_pr": null,
      "candidate_pr_status": null
    },
    "prod": {
      "promoted_at": null,
      "promoted_by_pr": null,
      "argocd_revision": null,
      "smoke_evidence": null,
      "verified_at": null,
      "candidate_pr": null,
      "candidate_pr_status": null
    }
  },
  "metadata": {
    "required_migrations": [],
    "backward_compatible_until": null,
    "rollback_safe": true,
    "rollback_to_digest": null
  },
  "audit": {
    "created_at": "2026-09-11T20:33:07Z",
    "last_updated_at": "2026-09-11T09:41:24Z",
    "ci_run_url": null
  }
}
