{
  "schema_version": "1.0",
  "repo": "platform-backend",
  "service": "notification-orchestrator",
  "git_sha": "70491543fdc3341fbf7685773efec74a6ca2ca473c90e38f89a5247e3568b1c3",
  "git_short_sha": "70491543",
  "image": {
    "registry": "ghcr.io",
    "path": "halildeu/platform-backend-notification-orchestrator",
    "digest": "sha256:70491543fdc3341fbf7685773efec74a6ca2ca473c90e38f89a5247e3568b1c3",
    "tag": "sha-7049154",
    "push_run_id": null,
    "pushed_at": "2026-05-10T18:19:45Z"
  },
  "promotion": {
    "test": {
      "promoted_at": "2026-05-18T19:02:24Z",
      "promoted_by_pr": null,
      "argocd_revision": null,
      "smoke_evidence": {
        "d29_up": {
          "status": "GREEN",
          "checked_at": "2026-05-18T19:02:24Z",
          "details": "up=all 9 services Running+Ready | secured=all 9 services have correct KC issuer for test"
        },
        "d29_functional": {
          "status": "GREEN",
          "checked_at": "2026-05-18T19:02:24Z",
          "endpoints": [
            "/actuator/health",
            "/api/v1/users",
            "/api/v1/variants",
            "/api/v1/permissions",
            "/api/v1/schema/snapshot",
            "/api/v1/reports",
            "/api/v1/impersonation/sessions",
            "/api/v1/companies",
            "/api/v1/notify/inbox/me"
          ],
          "details": "all 9 endpoints returned 200/401/403 (auth chain intact)"
        },
        "d29_zanzibar": {
          "status": "GREEN",
          "checked_at": "2026-05-18T19:02:24Z",
          "allow_deny_synthetic": "PASS",
          "details": "store_id_source=secret/permission-service-secrets:ERP_OPENFGA_STORE_ID; user:1204 admin=allow OK, user:9999999 admin=deny OK"
        }
      },
      "verified_at": "2026-05-18T19:02:24Z",
      "candidate_pr": null,
      "candidate_pr_status": null
    },
    "prod": {
      "promoted_at": null,
      "promoted_by_pr": null,
      "argocd_revision": null,
      "smoke_evidence": null,
      "verified_at": null,
      "candidate_pr": null,
      "candidate_pr_status": null
    }
  },
  "metadata": {
    "required_migrations": [],
    "backward_compatible_until": null,
    "rollback_safe": true,
    "rollback_to_digest": null
  },
  "audit": {
    "created_at": "2026-05-18T19:02:24Z",
    "last_updated_at": "2026-05-18T19:02:24Z",
    "ci_run_url": null
  }
}
