{
  "schema_version": "1.0",
  "repo": "platform-backend",
  "service": "core-data-service",
  "git_sha": "ec5cfd1b9ce3e84fc4ea81461ba488b2569170da8442b4c8c22c9198e37b573c",
  "git_short_sha": "ec5cfd1b",
  "image": {
    "registry": "ghcr.io",
    "path": "halildeu/platform-backend-core-data-service",
    "digest": "sha256:ec5cfd1b9ce3e84fc4ea81461ba488b2569170da8442b4c8c22c9198e37b573c",
    "tag": "sha-ec5cfd1",
    "push_run_id": null,
    "pushed_at": "2026-05-18T18:48:31Z"
  },
  "promotion": {
    "test": {
      "promoted_at": "2026-05-18T18:44:43Z",
      "promoted_by_pr": null,
      "argocd_revision": null,
      "smoke_evidence": {
        "d29_up": {
          "status": "GREEN",
          "checked_at": "2026-05-18T18:44:43Z",
          "details": "up=all 9 services Running+Ready | secured=all 9 services have correct KC issuer for test"
        },
        "d29_functional": {
          "status": "GREEN",
          "checked_at": "2026-05-18T18:44:43Z",
          "endpoints": [
            "/actuator/health",
            "/api/v1/users",
            "/api/v1/variants",
            "/api/v1/permissions",
            "/api/v1/schema/snapshot",
            "/api/v1/reports",
            "/actuator/health",
            "/actuator/health",
            "/actuator/health"
          ],
          "details": "all 9 endpoints returned 200/401/403 (auth chain intact)"
        },
        "d29_zanzibar": {
          "status": "GREEN",
          "checked_at": "2026-05-18T18:44:43Z",
          "allow_deny_synthetic": "PASS",
          "details": "store_id_source=secret/permission-service-secrets:ERP_OPENFGA_STORE_ID; user:1204 admin=allow OK, user:9999999 admin=deny OK"
        }
      },
      "verified_at": "2026-05-18T18:44:43Z",
      "candidate_pr": null,
      "candidate_pr_status": null
    },
    "prod": {
      "promoted_at": null,
      "promoted_by_pr": null,
      "argocd_revision": null,
      "smoke_evidence": null,
      "verified_at": null,
      "candidate_pr": null,
      "candidate_pr_status": null
    }
  },
  "metadata": {
    "required_migrations": [],
    "backward_compatible_until": null,
    "rollback_safe": true,
    "rollback_to_digest": null
  },
  "audit": {
    "created_at": "2026-05-18T18:48:31Z",
    "last_updated_at": "2026-05-18T18:44:43Z",
    "ci_run_url": null
  }
}
