{
  "schema_version": "1.0",
  "repo": "platform-backend",
  "service": "endpoint-admin-service",
  "git_sha": "3e1e5852838d1ae519bffbe604787c56052d7a0d9965f8c19f590ed3fae1f3bc",
  "git_short_sha": "3e1e5852",
  "image": {
    "registry": "ghcr.io",
    "path": "halildeu/platform-backend-endpoint-admin-service",
    "digest": "sha256:3e1e5852838d1ae519bffbe604787c56052d7a0d9965f8c19f590ed3fae1f3bc",
    "tag": "sha-3e1e585",
    "push_run_id": null,
    "pushed_at": "2026-06-08T21:55:46Z"
  },
  "promotion": {
    "test": {
      "promoted_at": null,
      "promoted_by_pr": null,
      "argocd_revision": null,
      "smoke_evidence": {
        "d29_up": {
          "status": "GREEN",
          "checked_at": "2026-06-08T21:21:55Z",
          "details": "up=all 10 services Running+Ready | secured=all 10 services have correct KC issuer for test"
        },
        "d29_functional": {
          "status": "GREEN",
          "checked_at": "2026-06-08T21:21:55Z",
          "endpoints": [
            "/actuator/health",
            "/api/v1/users",
            "/api/v1/variants",
            "/api/v1/permissions",
            "/api/v1/schema/schemas",
            "/api/v1/reports",
            "/api/v1/impersonation/sessions",
            "/api/v1/companies",
            "/api/v1/notify/inbox/me",
            "/api/v1/admin/endpoint-devices"
          ],
          "details": "all 10 endpoints returned 200/401/403 (auth chain intact)"
        },
        "d29_zanzibar": {
          "status": "GREEN",
          "checked_at": "2026-06-08T21:21:55Z",
          "allow_deny_synthetic": "PASS",
          "details": "store_id_source=secret/permission-service-secrets:ERP_OPENFGA_STORE_ID; user:1204 admin=allow OK, user:9999999 admin=deny OK"
        }
      },
      "verified_at": "2026-06-08T21:21:55Z",
      "candidate_pr": null,
      "candidate_pr_status": null
    },
    "prod": {
      "promoted_at": null,
      "promoted_by_pr": null,
      "argocd_revision": null,
      "smoke_evidence": null,
      "verified_at": null,
      "candidate_pr": null,
      "candidate_pr_status": null
    }
  },
  "metadata": {
    "required_migrations": [
      "endpoint-admin-service V51-V58 (org_id canonicalization C4 FK-flip remainder + V58 endpoint_display_policy) \u2014 additive, forward-only, rollback-safe (Codex migration GO)"
    ],
    "backward_compatible_until": null,
    "rollback_safe": true,
    "rollback_to_digest": null
  },
  "audit": {
    "created_at": "2026-06-08T21:55:46Z",
    "last_updated_at": "2026-06-08T21:21:55Z",
    "ci_run_url": null
  }
}
