{
  "schema_version": "1.0",
  "repo": "platform-backend",
  "service": "notification-orchestrator",
  "git_sha": "6ed593e0d7ba34ce603c483f23c598fcc8240082",
  "git_short_sha": "6ed593e0",
  "image": {
    "registry": "ghcr.io",
    "path": "halildeu/platform-backend-notification-orchestrator",
    "digest": "sha256:30b0bf658dcd879c531451352c4e37680551fe14ab667a255eea36adbb281a5b",
    "tag": "sha-6ed593e",
    "push_run_id": 26174852041,
    "pushed_at": "2026-05-20T16:26:33Z"
  },
  "promotion": {
    "test": {
      "promoted_at": "2026-05-20T17:06:00Z",
      "promoted_by_pr": 908,
      "argocd_revision": null,
      "smoke_evidence": {
        "d29_up": {
          "status": "GREEN",
          "checked_at": "2026-05-20T17:11:00Z",
          "details": "pod imageID=sha256:30b0bf658dcd... Running 1/1 (notification-orchestrator-55d6bd788b-d5pcx); SmsAdapter activated primary=jetsms; JetSmsDlrPollingWorker activated"
        },
        "d29_functional": {
          "status": "GREEN",
          "checked_at": "2026-05-20T17:30:26Z",
          "endpoints": [
            "/api/v1/notify/intents",
            "/actuator/health"
          ],
          "details": "3-senaryo canary smoke (Codex 019e4514 11 iter): Scenario A (auth.mfa-otp short) VFO routing log proven; Scenario B (marketing.campaign) VF DELIVERED msg_id=jetsms-2605202027306017971 segments=1; Scenario C (auth.mfa-otp overlength 209ch) VF explicit fallback DELIVERED msg_id=jetsms-260520203006838196 segments=2 (Codex P3 absorb); actual_channel audit propagation LIVE (DELIVERY_ACCEPTED.details actual_channel=VF kanit); real-world kullanici +905551815564 multipart SMS DELIVERED; evidence doc docs/faz-23-evidence/2026-05-20-23-3-2-jetsms-multipart-context-routing-evidence.md"
        },
        "d29_zanzibar": {
          "status": "GREEN",
          "checked_at": "2026-05-20T17:30:26Z",
          "allow_deny_synthetic": "PASS",
          "details": "Layer 1 NotifyOrgAccessGuard (JWT org_id claim) ALLOW kanit: smoke-tester (org_id=default) intent submit → HTTP 202 ACCEPTED (canary smoke 2026-05-20). DENY kanit: M2 D29-Authorized evidence (2026-05-14) d35-admin-persona without org_id → HTTP 403 (NotifyOrgAccessGuard hard-deny); aynı kod path 23.3.2 sub-Faz'da değişmedi (delivery-layer scope; auth-filter intact). Layer 2 channel-level authz (OpenFGA subscriber/template types) Faz 23.2 v2 scope; 23.3.2 chain'de değişmedi. NOTIFY_AUTHZ_ENABLED=true post-smoke restored."
        }
      },
      "verified_at": "2026-05-20T17:30:26Z",
      "candidate_pr": 908,
      "candidate_pr_status": "merged"
    },
    "prod": {
      "promoted_at": null,
      "promoted_by_pr": null,
      "argocd_revision": null,
      "smoke_evidence": null,
      "verified_at": null,
      "candidate_pr": 911,
      "candidate_pr_status": "ready_for_review"
    }
  },
  "metadata": {
    "required_migrations": [],
    "backward_compatible_until": null,
    "rollback_safe": true,
    "rollback_to_digest": "sha256:70491543fdc3341fbf7685773efec74a6ca2ca473c90e38f89a5247e3568b1c3"
  },
  "audit": {
    "created_at": "2026-05-20T18:00:00Z",
    "last_updated_at": "2026-05-20T18:00:00Z",
    "ci_run_url": "https://github.com/Halildeu/platform-backend/actions/runs/26174852041"
  }
}
