{
  "schema_version": "1.0",
  "repo": "platform-backend",
  "service": "endpoint-admin-service",
  "git_sha": "5af5f8dde4d3968403164215f7413c0287f144c7",
  "git_short_sha": "5af5f8dd",
  "image": {
    "registry": "ghcr.io",
    "path": "halildeu/platform-backend-endpoint-admin-service",
    "digest": "sha256:7fa5975c1d0c54e3611db5d89d7b8f8919c1952f6b74f94e562ffd1d90a0f9d2",
    "tag": "sha-5af5f8d",
    "push_run_id": 26988425047,
    "pushed_at": "2026-06-05T00:47:58Z"
  },
  "promotion": {
    "test": {
      "promoted_at": "2026-06-05T00:49:55Z",
      "promoted_by_pr": 1288,
      "argocd_revision": "a4ee013ada1983a3150b8e24ae69d73d0a378be7",
      "smoke_evidence": {
        "d29_up": {
          "status": "GREEN",
          "checked_at": "2026-06-05T19:05:14Z",
          "details": "Fresh testai smoke with endpoint-admin-service included in D29 service discovery: all 10 services Running+Ready.",
          "evidence_url": "https://github.com/Halildeu/platform-k8s-gitops/pull/1242#issuecomment-4634659892"
        },
        "d29_functional": {
          "status": "GREEN",
          "checked_at": "2026-06-05T19:05:14Z",
          "details": "All 10 endpoints returned 200/401/403 with auth chain intact; endpoint-admin-service covered via /api/v1/admin/endpoint-devices.",
          "evidence_url": "https://github.com/Halildeu/platform-k8s-gitops/pull/1242#issuecomment-4634659892",
          "endpoints": [
            "/actuator/health",
            "/api/v1/users",
            "/api/v1/variants",
            "/api/v1/permissions",
            "/api/v1/schema/schemas",
            "/api/v1/reports",
            "/api/v1/impersonation/sessions",
            "/api/v1/companies",
            "/api/v1/notify/inbox/me",
            "/api/v1/admin/endpoint-devices"
          ]
        },
        "d29_zanzibar": {
          "status": "GREEN",
          "checked_at": "2026-06-05T19:05:14Z",
          "details": "OpenFGA synthetic allow/deny passed: store_id from secret/permission-service-secrets:ERP_OPENFGA_STORE_ID; user:1204 admin=allow OK; user:9999999 admin=deny OK.",
          "evidence_url": "https://github.com/Halildeu/platform-k8s-gitops/pull/1242#issuecomment-4634659892",
          "allow_deny_synthetic": "PASS"
        }
      },
      "verified_at": "2026-06-05T19:05:14Z",
      "candidate_pr": null,
      "candidate_pr_status": null
    },
    "prod": {
      "promoted_at": null,
      "promoted_by_pr": null,
      "argocd_revision": null,
      "smoke_evidence": null,
      "verified_at": null,
      "candidate_pr": null,
      "candidate_pr_status": null
    }
  },
  "metadata": {
    "required_migrations": [
      "endpoint-admin-service V50 remaining catalog-consumer org-composite FK flips"
    ],
    "backward_compatible_until": null,
    "rollback_safe": false,
    "rollback_to_digest": "sha256:0af8e2bc67f285dce0c0389078a09b31a7d5e3a79df34e0c98b150aceecbde38"
  },
  "audit": {
    "created_at": "2026-06-05T19:10:12Z",
    "last_updated_at": "2026-06-05T19:10:12Z",
    "ci_run_url": "https://github.com/Halildeu/platform-backend/actions/runs/26988425047"
  }
}
