{
  "schema_version": "1.0",
  "repo": "platform-backend",
  "service": "user-service",
  "git_sha": "fce3096eb994cdd8c3911c3c9e64369b082ca066d5a24ce430146a22a8585541",
  "git_short_sha": "fce3096e",
  "image": {
    "registry": "ghcr.io",
    "path": "halildeu/platform-backend-user-service",
    "digest": "sha256:fce3096eb994cdd8c3911c3c9e64369b082ca066d5a24ce430146a22a8585541",
    "tag": "sha-fce3096",
    "push_run_id": 26093517489,
    "pushed_at": "2026-05-19T11:14:07Z"
  },
  "promotion": {
    "test": {
      "promoted_at": "2026-05-19T11:18:37Z",
      "promoted_by_pr": null,
      "argocd_revision": null,
      "smoke_evidence": {
        "d29_up": {
          "status": "GREEN",
          "checked_at": "2026-05-19T11:51:48Z",
          "details": "up=all 9 services Running+Ready | secured=all 9 services have correct KC issuer for test"
        },
        "d29_functional": {
          "status": "GREEN",
          "checked_at": "2026-05-19T11:51:48Z",
          "endpoints": [
            "/actuator/health",
            "/api/v1/users",
            "/api/v1/variants",
            "/api/v1/permissions",
            "/api/v1/schema/schemas",
            "/api/v1/reports",
            "/api/v1/impersonation/sessions",
            "/api/v1/companies",
            "/api/v1/notify/inbox/me"
          ],
          "details": "all 9 endpoints returned 200/401/403 (auth chain intact)"
        },
        "d29_zanzibar": {
          "status": "GREEN",
          "checked_at": "2026-05-19T11:51:48Z",
          "allow_deny_synthetic": "PASS",
          "details": "store_id_source=secret/permission-service-secrets:ERP_OPENFGA_STORE_ID; user:1204 admin=allow OK, user:9999999 admin=deny OK"
        }
      },
      "verified_at": "2026-05-19T11:51:48Z",
      "candidate_pr": null,
      "candidate_pr_status": null
    },
    "prod": {
      "promoted_at": null,
      "promoted_by_pr": null,
      "argocd_revision": null,
      "smoke_evidence": null,
      "verified_at": null,
      "candidate_pr": null,
      "candidate_pr_status": null
    }
  },
  "metadata": {
    "required_migrations": [],
    "backward_compatible_until": null,
    "rollback_safe": true,
    "rollback_to_digest": "sha256:c94c057cde2b82e87dc025ff06f75d1aa35ae82ae8858cd15e61942d37f0dc21"
  },
  "audit": {
    "created_at": "2026-05-19T11:51:48Z",
    "last_updated_at": "2026-05-19T11:51:48Z",
    "ci_run_url": "https://github.com/Halildeu/platform-backend/actions/runs/26093517489"
  }
}
