{
  "schema_version": "1.0",
  "repo": "platform-backend",
  "service": "user-service",
  "git_sha": "548c1831719298ce1b0c8a52b2e37c9bdba3ed4a",
  "git_short_sha": "548c1831",
  "image": {
    "registry": "ghcr.io",
    "path": "halildeu/platform-backend-user-service",
    "digest": "sha256:548c1831719298ce1b0c8a52b2e37c9bdba3ed4ab8cd939cfad54087774b390b",
    "tag": "sha-548c1831",
    "push_run_id": 25292510483,
    "pushed_at": "2026-05-04T08:50:36Z"
  },
  "promotion": {
    "test": {
      "promoted_at": "2026-05-04T09:00:00Z",
      "promoted_by_pr": 195,
      "argocd_revision": "548c1831",
      "smoke_evidence": {
        "d29_up": {
          "status": "GREEN",
          "checked_at": "2026-05-04T09:01:00Z",
          "details": "user-service Running 1/1, readiness 200"
        },
        "d29_functional": {
          "status": "GREEN",
          "checked_at": "2026-05-04T09:02:00Z",
          "endpoints": ["/api/v1/users", "/api/v1/users/me"],
          "details": "401 JWT required (auth chain intact)"
        },
        "d29_zanzibar": {
          "status": "GREEN",
          "checked_at": "2026-05-04T09:03:00Z",
          "allow_deny_synthetic": "PASS",
          "details": "super-admin allow + regular-user deny synthetic OK"
        }
      },
      "verified_at": "2026-05-04T09:05:00Z",
      "candidate_pr": null,
      "candidate_pr_status": null
    },
    "prod": {
      "promoted_at": null,
      "promoted_by_pr": null,
      "argocd_revision": null,
      "smoke_evidence": null,
      "verified_at": null,
      "candidate_pr": 196,
      "candidate_pr_status": "draft"
    }
  },
  "metadata": {
    "required_migrations": [],
    "backward_compatible_until": null,
    "rollback_safe": true,
    "rollback_to_digest": "sha256:df8b84d0cd02d064cf455f40017bd5cb4ca1be271e5e7068afeb36fc4526a7f1"
  },
  "audit": {
    "created_at": "2026-05-04T08:55:00Z",
    "last_updated_at": "2026-05-04T09:05:00Z",
    "ci_run_url": "https://github.com/Halildeu/platform-backend/actions/runs/25292510483"
  }
}
