{
  "schema_version": "1.0",
  "repo": "platform-backend",
  "service": "notification-orchestrator",
  "git_sha": "6307428f6667fb90864f222743fcb9d559a8ff26",
  "git_short_sha": "6307428f",
  "image": {
    "registry": "ghcr.io",
    "path": "halildeu/platform-backend-notification-orchestrator",
    "digest": "sha256:3b103e35e3978192556ea8dab8da60ef40f80514981d31ab1e001a27a005d74d",
    "tag": "sha-6307428",
    "push_run_id": 26185928228,
    "pushed_at": "2026-05-20T19:47:00Z"
  },
  "promotion": {
    "test": {
      "promoted_at": null,
      "promoted_by_pr": null,
      "argocd_revision": null,
      "smoke_evidence": null,
      "verified_at": null,
      "candidate_pr": null,
      "candidate_pr_status": null
    },
    "prod": {
      "promoted_at": null,
      "promoted_by_pr": null,
      "argocd_revision": null,
      "smoke_evidence": null,
      "verified_at": null,
      "candidate_pr": null,
      "candidate_pr_status": null
    }
  },
  "metadata": {
    "required_migrations": [],
    "backward_compatible_until": null,
    "rollback_safe": true,
    "rollback_to_digest": "sha256:30b0bf658dcd879c531451352c4e37680551fe14ab667a255eea36adbb281a5b"
  },
  "audit": {
    "created_at": "2026-05-20T19:50:00Z",
    "last_updated_at": "2026-05-20T19:50:00Z",
    "ci_run_url": "https://github.com/Halildeu/platform-backend/actions/runs/26185928228"
  }
}
